{"schema_version":2,"id":"forestry-town","settlement_type":"forestry-town","weight":3,"scene_model":"forestry-town-ground","plots":[{"id":1,"size":"small_station","at":[-104,1,-176],"orientation":"px_py","building":"small-station"},{"id":2,"size":"small_station","at":[104,1,-176],"orientation":"px_py"},{"id":3,"size":"medium","at":[-224,1,0],"orientation":"px_py","building":"vehicle-workshop"},{"id":4,"size":"small","at":[0,1,0],"orientation":"px_py","building":"small-warehouse"},{"id":5,"size":"medium","at":[224,1,0],"orientation":"px_py","building":"power-station"},{"id":6,"size":"medium","at":[-224,1,224],"orientation":"px_py","building":"logging-site"},{"id":7,"size":"medium","at":[0,1,224],"orientation":"px_py","building":"light-industry-factory"},{"id":8,"size":"small","at":[224,1,224],"orientation":"px_py"},{"id":9,"size":"small","at":[-224,1,448],"orientation":"px_py"},{"id":10,"size":"small","at":[0,1,448],"orientation":"px_py"}],"founding":[{"plot":1,"building":"small-station"},{"plot":10,"building":"basic-shed"}],"inventory":[],"production_plans":[],"display":{"name":"林业镇基础布局","description":"十地块布局，含两个站点地块与委托、仓储、供能设施；生产计划和库存待后续切片。"}}
