{"schema_version":2,"id":"agricultural-town","settlement_type":"agricultural-town","weight":3,"scene_model":"agricultural-town-ground","plots":[{"id":1,"size":"small_station","at":[-104,1,-176],"orientation":"px_py","building":"small-station"},{"id":2,"size":"small_station","at":[104,1,-176],"orientation":"px_py"},{"id":3,"size":"medium","at":[-224,1,0],"orientation":"px_py","building":"vehicle-workshop"},{"id":4,"size":"small","at":[0,1,0],"orientation":"px_py","building":"small-warehouse"},{"id":5,"size":"medium","at":[224,1,0],"orientation":"px_py","building":"power-station"},{"id":6,"size":"medium","at":[-224,1,224],"orientation":"px_py","building":"farm"},{"id":7,"size":"small","at":[0,1,224],"orientation":"px_py","building":"food-factory"},{"id":8,"size":"small","at":[224,1,224],"orientation":"px_py"},{"id":9,"size":"small","at":[-224,1,448],"orientation":"px_py"},{"id":10,"size":"small","at":[0,1,448],"orientation":"px_py"}],"founding":[{"plot":1,"building":"small-station"},{"plot":10,"building":"basic-shed"}],"inventory":[],"production_plans":[{"plot":6,"capability":"production","process":"grain-farming","enabled":true,"priority":0},{"plot":7,"capability":"production","process":"staple-food-processing","enabled":true,"priority":0}],"display":{"name":"农业镇经济布局","description":"十地块布局，含两个站点地块与真实生产计划；特殊库存为空，普通初始化待核心生成器支持。"}}
