{
  "schema_version": 2,
  "id": "farm-village",
  "settlement_type": "farm",
  "weight": 2,
  "scene_model": "village-ground",
  "plots": [
    {
      "id": 1,
      "size": "small_station",
      "at": [
        -72,
        1,
        0
      ],
      "orientation": "pz_py",
      "building": "small-station"
    },
    {
      "id": 2,
      "size": "small",
      "at": [
        40,
        1,
        -64
      ],
      "building": "warehouse"
    },
    {
      "id": 3,
      "size": "medium",
      "at": [
        72,
        1,
        48
      ]
    }
  ],
  "founding": [
    {
      "plot": 1,
      "building": "small-station"
    }
  ],
  "inventory": [
    {
      "voxel": "grain",
      "quantity": 40
    }
  ],
  "display": {
    "name": "农庄村落",
    "description": "一个站点、一座仓库和一块空着的中地块；开局存有 40 份粮食。"
  },
  "production_plans": []
}
